{
  "dcp_version": "2.0",
  "dispute_id": "dispute:res-conflict-2026-042",
  "session_nonce": "a1b2c3d4e5f6a1b2c3d4e5f6a1b2c3d4e5f6a1b2c3d4e5f6a1b2c3d4e5f6a1b2",
  "arbitrator_ids": [
    "agent:arbitrator-neutral-007",
    "human:bob-def-456"
  ],
  "resolution": "Research-bot-v2-001 is granted priority access to the shared knowledge-base API during weekday business hours (08:00-18:00 UTC). Data-pipeline-bot-003 retains priority during off-peak hours. Both agents must implement rate-limiting to 100 requests per minute.",
  "binding": true,
  "precedent_references": [
    "juris:shared-api-access-2025-018",
    "juris:rate-limit-fairness-2025-033"
  ],
  "timestamp": "2026-03-18T16:45:00Z",
  "composite_sig": {
    "classical": { "alg": "ed25519", "kid": "a1b2c3d4e5f6a1b2c3d4e5f6a1b2c3d4", "sig_b64": "dGVzdHNpZzEyMzQ1Njc4OTAxMjM0NTY=" },
    "pq": { "alg": "ml-dsa-65", "kid": "d4e5f6a1b2c3d4e5f6a1b2c3d4e5f6a1", "sig_b64": "dGVzdHBxc2lnMTIzNDU2Nzg5MDEyMzQ1Ng==" },
    "binding": "pq_over_classical"
  }
}
